{
  "schemaVersion": 1,
  "revision": 1,
  "id": "merz-theory-05-detail-04",
  "kind": "theory",
  "title": "§ 5. Параллельный след в призме",
  "status": "reviewed",
  "source": {
    "bookId": "merzlyak-2022-10-base",
    "collection": "theory",
    "point": "5",
    "subpart": "задача 2: сечение призмы через ребро",
    "chapter": "Глава 2. Параллельность в пространстве",
    "printedPages": [
      44
    ],
    "pdfPages": [
      45
    ]
  },
  "statement": {
    "text": "В треугольной призме ABCA₁B₁C₁ построй сечение через ребро AC и внутреннюю точку M ребра A₁B₁.",
    "goal": "Восстанови рассуждение по модели, затем запиши своё обоснование."
  },
  "visualization": {
    "type": "scene3d",
    "caption": "Модель показывает конкретную допустимую конфигурацию. Доказательство относится ко всем случаям, указанным в условии. Прямые и плоскости продолжаются за показанные фрагменты; длины и углы по экрану не измеряют.",
    "model": {
      "points": {
        "A": [
          0,
          0,
          0
        ],
        "B": [
          4,
          0,
          0
        ],
        "C": [
          1,
          3,
          0
        ],
        "A1": [
          0.5,
          0.4,
          3
        ],
        "B1": [
          4.5,
          0.4,
          3
        ],
        "C1": [
          1.5,
          3.4,
          3
        ],
        "M": [
          2.1,
          0.4,
          3.0
        ],
        "N": [
          2.7,
          2.1999999999999997,
          3.0
        ]
      },
      "edges": [
        [
          "A",
          "B"
        ],
        [
          "B",
          "C"
        ],
        [
          "C",
          "A"
        ],
        [
          "A1",
          "B1"
        ],
        [
          "B1",
          "C1"
        ],
        [
          "C1",
          "A1"
        ],
        [
          "A",
          "A1"
        ],
        [
          "B",
          "B1"
        ],
        [
          "C",
          "C1"
        ],
        [
          "A",
          "M"
        ],
        [
          "M",
          "N"
        ],
        [
          "N",
          "C"
        ],
        [
          "C",
          "A"
        ]
      ],
      "views": {
        "neutral": {
          "label": "Условие и обозначения"
        },
        "top": {
          "label": "Параллель в верхнем основании",
          "segments": [
            [
              "M",
              "N"
            ],
            [
              "A1",
              "C1"
            ]
          ]
        },
        "section": {
          "label": "Четырёхугольник AMNC",
          "polygon": [
            "A",
            "M",
            "N",
            "C"
          ]
        }
      },
      "labelNames": [
        "A",
        "B",
        "C",
        "A1",
        "B1",
        "C1",
        "M",
        "N"
      ],
      "faces": [
        [
          "A",
          "B",
          "C"
        ],
        [
          "A1",
          "B1",
          "C1"
        ]
      ]
    }
  },
  "help": [
    {
      "id": "help-1",
      "question": "Как начать рассуждение?",
      "text": "В верхнем основании направление следа задано ребром AC, параллельным этому основанию."
    }
  ],
  "steps": [
    {
      "title": "Определим направление следа",
      "prompt": "Определим направление следа: объясни этот переход до открытия разбора.",
      "explanation": "AC∥A₁C₁, потому что ACC₁A₁ — параллелограмм. AC не лежит в верхнем основании, поэтому AC∥(A₁B₁C₁).",
      "justifications": [
        {
          "kind": "theorem",
          "text": "Аксиомы и теоремы, указанные в рассуждении."
        }
      ],
      "view": "top",
      "id": "step-1"
    },
    {
      "title": "Построим четвёртую вершину",
      "prompt": "Построим четвёртую вершину: объясни этот переход до открытия разбора.",
      "explanation": "Секущая плоскость содержит AC и M. По теореме 5.2 её след на верхнем основании проходит через M параллельно AC. Проведём MN∥A₁C₁ до N∈B₁C₁.",
      "justifications": [
        {
          "kind": "theorem",
          "text": "Аксиомы и теоремы, указанные в рассуждении."
        }
      ],
      "view": "top",
      "id": "step-2"
    },
    {
      "title": "Замкнём и проверим сечение",
      "prompt": "Замкнём и проверим сечение: объясни этот переход до открытия разбора.",
      "explanation": "Соединим AM и NC в боковых гранях. AC,MN,AM,NC принадлежат секущей плоскости и соответствующим граням. Искомое сечение — AMNC.",
      "justifications": [
        {
          "kind": "theorem",
          "text": "Аксиомы и теоремы, указанные в рассуждении."
        }
      ],
      "view": "section",
      "id": "step-3"
    }
  ],
  "answer": {
    "mode": "manual",
    "prompt": "Запиши доказательство или построение своими словами, указывая условия применённых теорем. Запись сохраняется; доказательство автоматически не оценивается."
  },
  "review": {
    "source": "passed",
    "mathematics": "passed",
    "pedagogy": "passed",
    "reviewer": "/root",
    "at": "2026-10-22T23:06:23Z"
  }
}
