{
  "schemaVersion": 1,
  "revision": 1,
  "id": "ex-09-011",
  "kind": "exercise",
  "title": "9.11. Ребро прямоугольного параллелепипеда",
  "status": "reviewed",
  "source": {
    "bookId": "merzlyak-2022-10-base",
    "collection": "main",
    "exercise": "9.11",
    "chapter": "Глава 3. Перпендикулярность в пространстве",
    "printedPages": [
      95
    ],
    "pdfPages": [
      96
    ]
  },
  "statement": {
    "text": "В прямоугольном параллелепипеде ABCDA₁B₁C₁D₁ диагональ B₁D=17 см, диагональ боковой грани AB₁=15 см. Найдите AD.",
    "goal": "Ребро прямоугольного параллелепипеда. Обоснуйте результат."
  },
  "visualization": {
    "type": "scene3d",
    "caption": "Авторская схема условия и построения. Координаты подобраны для наглядности; длины и углы следует доказывать, а не измерять по изображению.",
    "model": {
      "points": {
        "A": [
          0,
          0,
          0
        ],
        "B": [
          0,
          9,
          0
        ],
        "C": [
          8,
          9,
          0
        ],
        "D": [
          8,
          0,
          0
        ],
        "A1": [
          0,
          0,
          12
        ],
        "B1": [
          0,
          9,
          12
        ],
        "C1": [
          8,
          9,
          12
        ],
        "D1": [
          8,
          0,
          12
        ]
      },
      "edges": [
        [
          "A",
          "B"
        ],
        [
          "B",
          "C"
        ],
        [
          "C",
          "D"
        ],
        [
          "D",
          "A"
        ],
        [
          "A1",
          "B1"
        ],
        [
          "B1",
          "C1"
        ],
        [
          "C1",
          "D1"
        ],
        [
          "D1",
          "A1"
        ],
        [
          "A",
          "A1"
        ],
        [
          "B",
          "B1"
        ],
        [
          "C",
          "C1"
        ],
        [
          "D",
          "D1"
        ]
      ],
      "faces": [
        [
          "A",
          "B",
          "C",
          "D"
        ],
        [
          "A1",
          "B1",
          "C1",
          "D1"
        ],
        [
          "A",
          "B",
          "B1",
          "A1"
        ],
        [
          "B",
          "C",
          "C1",
          "B1"
        ],
        [
          "C",
          "D",
          "D1",
          "C1"
        ],
        [
          "D",
          "A",
          "A1",
          "D1"
        ]
      ],
      "labelNames": [],
      "planar": false,
      "views": {
        "neutral": {
          "label": "Данные задачи",
          "points": [
            "A",
            "B",
            "C",
            "D",
            "A1",
            "B1",
            "C1",
            "D1"
          ]
        },
        "right": {
          "label": "Прямоугольный AB₁D",
          "polygon": [
            "A",
            "B1",
            "D"
          ],
          "points": [
            "A",
            "B1",
            "D"
          ]
        }
      }
    }
  },
  "help": [
    {
      "id": "help-1",
      "question": "Подсказка к первому шагу",
      "text": "AD перпендикулярна AB и AA₁, поэтому AD ⟂ (ABB₁A₁), в частности AD ⟂ AB₁."
    }
  ],
  "steps": [
    {
      "title": "Перпендикуляр к грани",
      "prompt": "Перпендикуляр к грани — выполните этот шаг самостоятельно.",
      "explanation": "AD перпендикулярна AB и AA₁, поэтому AD ⟂ (ABB₁A₁), в частности AD ⟂ AB₁.",
      "view": "right",
      "justifications": [
        {
          "kind": "theorem",
          "text": "Используем данное условие и свойства указанной фигуры."
        }
      ],
      "id": "step-1"
    },
    {
      "title": "Гипотенуза",
      "prompt": "Гипотенуза — выполните этот шаг самостоятельно.",
      "explanation": "В прямоугольном AB₁D гипотенуза B₁D=17, катет AB₁=15.",
      "view": "right",
      "justifications": [
        {
          "kind": "theorem",
          "text": "Используем данное условие и свойства указанной фигуры."
        }
      ],
      "id": "step-2"
    },
    {
      "title": "Вычисление",
      "prompt": "Вычисление — выполните этот шаг самостоятельно.",
      "explanation": "AD=√(17²−15²)=√64=8 см.",
      "view": "right",
      "justifications": [
        {
          "kind": "theorem",
          "text": "Используем данное условие и свойства указанной фигуры."
        }
      ],
      "id": "step-3"
    }
  ],
  "answer": {
    "mode": "manual",
    "prompt": "Запишите доказательство или ответ и объясните каждый переход. Доказательство обсуждается с учителем и автоматически не оценивается."
  },
  "review": {
    "source": "passed",
    "mathematics": "passed",
    "pedagogy": "passed",
    "reviewer": "/root/lessons_para1",
    "at": "2026-10-22T23:06:23Z"
  }
}
