{
  "schemaVersion": 1,
  "revision": 1,
  "id": "ex-02-006",
  "kind": "exercise",
  "title": "№ 2.6. Прямая через общую точку",
  "status": "reviewed",
  "source": {
    "bookId": "merzlyak-2022-10-base",
    "collection": "main",
    "exercise": "2.6",
    "chapter": "Глава 1. Введение в стереометрию",
    "printedPages": [
      15
    ],
    "pdfPages": [
      16
    ]
  },
  "statement": {
    "text": "Прямые a и b пересекаются. Все ли прямые, пересекающие прямые a и b, лежат в одной плоскости?",
    "goal": "Проверь утверждение и объясни роль общей точки пересечения."
  },
  "visualization": {
    "type": "scene3d",
    "caption": "Это отдельная схема к задаче. Прямые и плоскости продолжаются за границами нарисованных фрагментов; величины не определяют измерением рисунка.",
    "model": {
      "points": {
        "O": [
          0,
          0,
          0
        ],
        "A": [
          -2,
          0,
          0
        ],
        "B": [
          2,
          0,
          0
        ],
        "C": [
          0,
          -2,
          0
        ],
        "D": [
          0,
          2,
          0
        ],
        "T": [
          0,
          0,
          2
        ],
        "_p0": [
          -3,
          -2,
          0
        ],
        "_p1": [
          3,
          -2,
          0
        ],
        "_p2": [
          3,
          2,
          0
        ],
        "_p3": [
          -3,
          2,
          0
        ]
      },
      "edges": [
        [
          "A",
          "B"
        ],
        [
          "C",
          "D"
        ],
        [
          "O",
          "T"
        ]
      ],
      "views": {
        "neutral": {
          "label": "Исходная конфигурация"
        },
        "plane": {
          "label": "a=AB и b=CD лежат в α",
          "polygon": [
            "_p0",
            "_p1",
            "_p2",
            "_p3"
          ]
        },
        "counter": {
          "label": "OT пересекает обе прямые в O, но выходит из α",
          "segments": [
            [
              "O",
              "T"
            ]
          ],
          "points": [
            "O",
            "T"
          ]
        },
        "two": {
          "label": "AD пересекает a и b в разных точках",
          "segments": [
            [
              "A",
              "D"
            ]
          ]
        }
      },
      "labelNames": [
        "O",
        "A",
        "B",
        "C",
        "D",
        "T"
      ],
      "faces": [
        [
          "_p0",
          "_p1",
          "_p2",
          "_p3"
        ]
      ]
    }
  },
  "help": [
    {
      "id": "help-1",
      "question": "С чего начать?",
      "text": "Новая прямая может пересекать обе исходные прямые в одной и той же точке."
    }
  ],
  "steps": [
    {
      "title": "Плоскость исходных прямых",
      "prompt": "Как задать общую плоскость a и b?",
      "explanation": "Две пересекающиеся прямые a,b определяют плоскость α. Обозначим их общую точку O.",
      "justifications": [
        {
          "kind": "theorem",
          "text": "Теорема 2.2."
        }
      ],
      "view": "plane",
      "id": "step-1"
    },
    {
      "title": "Два разных пересечения",
      "prompt": "Что будет, если новая прямая пересекает a в A и b в D, причём A≠D?",
      "explanation": "Тогда новая прямая имеет две разные точки A,D в α, поэтому лежит в α. Но условие задачи не требует разных точек пересечения.",
      "justifications": [
        {
          "kind": "theorem",
          "text": "Аксиома A3."
        }
      ],
      "view": "two",
      "id": "step-2"
    },
    {
      "title": "Пересечение в общей точке",
      "prompt": "Выбери T вне α. Что делает прямая OT?",
      "explanation": "OT пересекает и a, и b в точке O. При этом T∉α, значит, OT не лежит в α. Следовательно, ответ «нет»: не все такие прямые лежат в одной плоскости.",
      "justifications": [
        {
          "kind": "theorem",
          "text": "Контрпример через общую точку O."
        }
      ],
      "view": "counter",
      "id": "step-3"
    }
  ],
  "answer": {
    "mode": "manual",
    "prompt": "Запиши вывод и его обоснование. Запись сохраняется для обсуждения с преподавателем; доказательство автоматически не оценивается."
  },
  "review": {
    "source": "passed",
    "mathematics": "passed",
    "pedagogy": "passed",
    "reviewer": "/root/lessons_para1; /root/textbook_inventory",
    "at": "2026-10-22T23:06:23Z"
  }
}
