{
  "schemaVersion": 1,
  "revision": 1,
  "id": "ex-19-003",
  "kind": "exercise",
  "title": "19.3. Площадь по двугранному углу",
  "status": "reviewed",
  "source": {
    "bookId": "merzlyak-2022-10-base",
    "collection": "main",
    "exercise": "19.3",
    "chapter": "Глава 4. Многогранники",
    "printedPages": [
      173,
      174
    ],
    "pdfPages": [
      174,
      175
    ]
  },
  "statement": {
    "text": "Стороны оснований правильной треугольной усечённой пирамиды равны 12 и 18 см, двугранный угол при ребре большего основания 45°. Найдите боковую поверхность.",
    "goal": "Площадь по двугранному углу. Обоснуйте результат."
  },
  "visualization": {
    "type": "scene3d",
    "caption": "Авторская схема условия и построения. Координаты подобраны для наглядности; длины и углы следует доказывать, а не измерять по изображению.",
    "model": {
      "points": {
        "A": [
          10.392304845413264,
          0.0,
          0
        ],
        "B": [
          -5.196152422706629,
          9.0,
          0
        ],
        "C": [
          -5.1961524227066365,
          -8.999999999999998,
          0
        ],
        "A1": [
          6.92820323027551,
          0.0,
          1.7320508075688772
        ],
        "B1": [
          -3.464101615137753,
          6.0,
          1.7320508075688772
        ],
        "C1": [
          -3.464101615137758,
          -5.999999999999998,
          1.7320508075688772
        ],
        "O": [
          0.0,
          0.0,
          0.0
        ],
        "O1": [
          0.0,
          0.0,
          1.732050808
        ],
        "K": [
          2.598076211,
          4.5,
          0.0
        ],
        "K1": [
          1.732050808,
          3.0,
          1.732050808
        ],
        "H": [
          1.732050808,
          3.0,
          0.0
        ],
        "T": [
          6.92820323,
          0.0,
          0.0
        ]
      },
      "edges": [
        [
          "A",
          "B"
        ],
        [
          "A1",
          "B1"
        ],
        [
          "A",
          "A1"
        ],
        [
          "B",
          "C"
        ],
        [
          "B1",
          "C1"
        ],
        [
          "B",
          "B1"
        ],
        [
          "C",
          "A"
        ],
        [
          "C1",
          "A1"
        ],
        [
          "C",
          "C1"
        ]
      ],
      "faces": [
        [
          "A",
          "B",
          "C"
        ],
        [
          "A1",
          "B1",
          "C1"
        ],
        [
          "A",
          "B",
          "B1",
          "A1"
        ],
        [
          "B",
          "C",
          "C1",
          "B1"
        ],
        [
          "C",
          "A",
          "A1",
          "C1"
        ]
      ],
      "labelNames": [],
      "planar": false,
      "views": {
        "neutral": {
          "label": "Данные задачи",
          "points": [
            "A",
            "B",
            "C",
            "A1",
            "B1",
            "C1"
          ]
        },
        "apothem": {
          "label": "Апофема KK₁ и её проекция KH",
          "segments": [
            [
              "K",
              "K1"
            ],
            [
              "K1",
              "H"
            ]
          ],
          "polygon": [
            "K",
            "K1",
            "H"
          ],
          "points": [
            "K",
            "K1",
            "H",
            "O",
            "O1"
          ]
        },
        "edge": {
          "label": "Боковое ребро и его проекция",
          "segments": [
            [
              "A",
              "A1"
            ],
            [
              "A1",
              "T"
            ]
          ],
          "polygon": [
            "A",
            "A1",
            "T"
          ],
          "points": [
            "A",
            "A1",
            "T",
            "O",
            "O1"
          ]
        },
        "face": {
          "label": "Боковая трапеция",
          "segments": [
            [
              "K",
              "K1"
            ]
          ],
          "polygon": [
            "A",
            "B",
            "B1",
            "A1"
          ],
          "points": [
            "A",
            "B",
            "A1",
            "B1",
            "K",
            "K1"
          ]
        }
      }
    }
  },
  "help": [
    {
      "id": "help-1",
      "question": "Подсказка к первому шагу",
      "text": "Радиусы вписанных окружностей оснований r₁=18√3/6=3√3 и r₂=12√3/6=2√3. Проекция апофемы KH=r₁−r₂=√3."
    }
  ],
  "steps": [
    {
      "title": "Проекция апофемы",
      "prompt": "Проекция апофемы — выполните этот шаг самостоятельно.",
      "explanation": "Радиусы вписанных окружностей оснований r₁=18√3/6=3√3 и r₂=12√3/6=2√3. Проекция апофемы KH=r₁−r₂=√3.",
      "view": "apothem",
      "justifications": [
        {
          "kind": "theorem",
          "text": "Используем данное условие и свойства указанной фигуры."
        }
      ],
      "id": "step-1"
    },
    {
      "title": "Апофема",
      "prompt": "Апофема — выполните этот шаг самостоятельно.",
      "explanation": "В перпендикулярном сечении ∠K₁KH=45°, поэтому l=KK₁=KH/cos45°=√6.",
      "view": "apothem",
      "justifications": [
        {
          "kind": "theorem",
          "text": "Используем данное условие и свойства указанной фигуры."
        }
      ],
      "id": "step-2"
    },
    {
      "title": "Боковая поверхность",
      "prompt": "Боковая поверхность — выполните этот шаг самостоятельно.",
      "explanation": "Sбок=(3·18+3·12)·√6/2=45√6 см².",
      "view": "face",
      "justifications": [
        {
          "kind": "theorem",
          "text": "Используем данное условие и свойства указанной фигуры."
        }
      ],
      "id": "step-3"
    }
  ],
  "answer": {
    "mode": "manual",
    "prompt": "Запишите доказательство или ответ и объясните каждый переход. Доказательство обсуждается с учителем и автоматически не оценивается."
  },
  "review": {
    "source": "passed",
    "mathematics": "passed",
    "pedagogy": "passed",
    "reviewer": "/root/textbook_inventory",
    "at": "2026-10-22T23:06:23Z"
  }
}
