{
  "schemaVersion": 1,
  "id": "ex-main-0276-a",
  "revision": 1,
  "kind": "exercise",
  "title": "Центры симметрии параллелепипеда",
  "status": "reviewed",
  "source": {
    "bookId": "atanasyan-2024-10-11",
    "collection": "main",
    "chapter": "III. Многогранники",
    "printedPages": [
      84
    ],
    "pdfPages": [
      86
    ],
    "subpart": "а",
    "exercise": "276"
  },
  "statement": {
    "text": "Определи число центров симметрии произвольного параллелепипеда.",
    "goal": "Найди число центров симметрии параллелепипеда."
  },
  "visualization": {
    "type": "scene3d",
    "caption": "Поворачивай модель. Открывай шаги по одному: новые линии появляются по ходу разбора.",
    "model": {
      "points": {
        "A": [
          -1.75,
          -1.2,
          -1
        ],
        "B": [
          0.25,
          -1.2,
          -1
        ],
        "C": [
          1.15,
          0.8,
          -1
        ],
        "D": [
          -0.85,
          0.8,
          -1
        ],
        "A1": [
          -1.15,
          -0.8,
          1
        ],
        "B1": [
          0.85,
          -0.8,
          1
        ],
        "C1": [
          1.75,
          1.2,
          1
        ],
        "D1": [
          -0.25,
          1.2,
          1
        ],
        "O": [
          0,
          0,
          0
        ]
      },
      "edges": [
        [
          "A",
          "B"
        ],
        [
          "B",
          "C"
        ],
        [
          "C",
          "D"
        ],
        [
          "D",
          "A"
        ],
        [
          "A1",
          "B1"
        ],
        [
          "B1",
          "C1"
        ],
        [
          "C1",
          "D1"
        ],
        [
          "D1",
          "A1"
        ],
        [
          "A",
          "A1"
        ],
        [
          "B",
          "B1"
        ],
        [
          "C",
          "C1"
        ],
        [
          "D",
          "D1"
        ]
      ],
      "faces": [
        [
          "A",
          "B",
          "C",
          "D"
        ],
        [
          "A1",
          "B1",
          "C1",
          "D1"
        ],
        [
          "A",
          "B",
          "B1",
          "A1"
        ],
        [
          "B",
          "C",
          "C1",
          "B1"
        ],
        [
          "C",
          "D",
          "D1",
          "C1"
        ],
        [
          "D",
          "A",
          "A1",
          "D1"
        ]
      ],
      "labelNames": [
        "A",
        "B",
        "C",
        "D",
        "A1",
        "C1"
      ],
      "neutralPoints": [
        "A",
        "B",
        "C",
        "D",
        "A1",
        "B1",
        "C1",
        "D1"
      ],
      "views": {
        "neutral": {
          "label": "Исходная фигура; вспомогательные построения пока скрыты"
        },
        "center": {
          "label": "Диагонали пересекаются в общей середине",
          "segments": [
            [
              "A",
              "C1"
            ],
            [
              "B",
              "D1"
            ],
            [
              "C",
              "A1"
            ],
            [
              "D",
              "B1"
            ]
          ],
          "points": [
            "O"
          ]
        }
      }
    }
  },
  "help": [
    {
      "id": "h1",
      "question": "Нужны ли прямые углы у граней?",
      "text": "Нет. Общая середина диагоналей есть у любого параллелепипеда.",
      "view": "center"
    },
    {
      "id": "definition",
      "question": "Какое определение симметрии здесь используется?",
      "text": "Центр симметрии делит отрезок между точкой и её образом пополам. Это должно выполняться для всех точек фигуры.",
      "theoryIds": [
        "theory-035-center",
        "theory-035-figure"
      ]
    }
  ],
  "steps": [
    {
      "title": "Найди общую середину диагоналей",
      "prompt": "Где может находиться центр?",
      "explanation": "Диагонали параллелепипеда пересекаются в одной точке O и делятся ею пополам. Прямоугольность не требуется.",
      "view": "center",
      "justifications": [
        {
          "kind": "theorem",
          "text": "Свойство диагоналей параллелепипеда."
        }
      ],
      "id": "step-1"
    },
    {
      "title": "Проверь преобразование тела",
      "prompt": "Что произойдёт с противоположными вершинами?",
      "explanation": "Центральная симметрия относительно O попарно переставляет противоположные вершины. Точки отрезков между вершинами, а затем точки отрезков между уже полученными точками заполняют параллелепипед. Каждый такой отрезок переходит в отрезок внутри того же тела, поэтому образ любой точки остаётся в параллелепипеде.",
      "view": "center",
      "justifications": [
        {
          "kind": "definition",
          "text": "Определение симметрии: образ каждой точки должен принадлежать той же фигуре.",
          "theoryId": "theory-035-figure"
        }
      ],
      "id": "step-2"
    },
    {
      "title": "Исключи второй центр",
      "prompt": "Почему второго центра нет?",
      "explanation": "Параллелепипед ограничен. Два разных центра породили бы ненулевой перенос, сохраняющий тело, что невозможно для ограниченного тела. Ответ: 1.",
      "view": "center",
      "justifications": [
        {
          "kind": "theorem",
          "text": "У ограниченной непустой фигуры не более одного центра симметрии."
        }
      ],
      "id": "step-3"
    }
  ],
  "review": {
    "source": "passed",
    "mathematics": "passed",
    "pedagogy": "passed",
    "reviewer": "Codex independent symmetry_review; visual_pedagogy_review",
    "at": "2026-10-23T21:04:00.795Z"
  },
  "answer": {
    "mode": "manual",
    "prompt": "Найди число центров симметрии параллелепипеда. Запиши число или условие и объясни, почему других вариантов нет."
  }
}
