{
  "schemaVersion": 1,
  "id": "ex-selfcheck-i-13",
  "revision": 2,
  "kind": "exercise",
  "title": "Вопрос 13. Равные, но непараллельные отрезки",
  "status": "reviewed",
  "source": {
    "bookId": "atanasyan-2024-10-11",
    "collection": "selfcheck",
    "exercise": "13",
    "chapter": "I. Параллельность прямых и плоскостей",
    "printedPages": [
      33
    ],
    "pdfPages": [
      35
    ]
  },
  "statement": {
    "text": "Могут ли быть равны два непараллельных отрезка, заключённых между параллельными плоскостями? «Заключены между» означает, что один конец каждого отрезка принадлежит одной плоскости, а другой — второй.",
    "goal": "Выясни, возможны ли равные непараллельные отрезки между параллельными плоскостями."
  },
  "visualization": {
    "type": "scene3d",
    "caption": "Рассмотри исходные объекты и поверни модель. Подсказки и шаги открывают дополнительные построения на этой же странице.",
    "model": {
      "points": {
        "_alpha0": [
          -4,
          -3,
          0
        ],
        "_alpha1": [
          4,
          -3,
          0
        ],
        "_alpha2": [
          4,
          3,
          0
        ],
        "_alpha3": [
          -4,
          3,
          0
        ],
        "_alphalabel": [
          -4,
          3,
          0
        ],
        "_beta0": [
          -4,
          -3,
          2
        ],
        "_beta1": [
          4,
          -3,
          2
        ],
        "_beta2": [
          4,
          3,
          2
        ],
        "_beta3": [
          -4,
          3,
          2
        ],
        "_betalabel": [
          -4,
          3,
          2
        ],
        "A": [
          -2,
          0,
          0
        ],
        "B": [
          2,
          0,
          0
        ],
        "C": [
          2,
          0,
          2
        ],
        "D": [
          -2,
          0,
          2
        ]
      },
      "edges": [],
      "faces": [
        [
          "_alpha0",
          "_alpha1",
          "_alpha2",
          "_alpha3"
        ],
        [
          "_beta0",
          "_beta1",
          "_beta2",
          "_beta3"
        ]
      ],
      "labels": {
        "_alphalabel": "α",
        "_betalabel": "β"
      },
      "labelNames": [
        "_alphalabel",
        "_betalabel"
      ],
      "neutralPoints": [
        "_alphalabel",
        "_betalabel"
      ],
      "views": {
        "neutral": {
          "label": "Исходные объекты"
        },
        "rectangle": {
          "label": "Прямоугольник между плоскостями",
          "segments": [
            [
              "A",
              "B"
            ],
            [
              "B",
              "C"
            ],
            [
              "C",
              "D"
            ],
            [
              "D",
              "A"
            ]
          ],
          "polygon": [
            "A",
            "B",
            "C",
            "D"
          ],
          "points": [
            "A",
            "B",
            "C",
            "D"
          ]
        },
        "diagonals": {
          "label": "Два отрезка между плоскостями",
          "segments": [
            [
              "A",
              "B"
            ],
            [
              "B",
              "C"
            ],
            [
              "C",
              "D"
            ],
            [
              "D",
              "A"
            ],
            [
              "A",
              "C"
            ],
            [
              "B",
              "D"
            ]
          ],
          "polygon": [
            "A",
            "B",
            "C",
            "D"
          ],
          "points": [
            "A",
            "B",
            "C",
            "D"
          ]
        }
      },
      "note": "На рисунке отрезки могут изображать части прямых, а многоугольники — части плоскостей. Размеры и углы рисунка не являются дополнительными условиями. Новые построения открываются вместе с объяснением."
    }
  },
  "help": [
    {
      "id": "help-1",
      "question": "Какая плоская фигура имеет равные непараллельные диагонали?",
      "text": "Рассмотри прямоугольник, две противоположные стороны которого лежат в данных плоскостях.",
      "theoryIds": [
        "atanasyan2024-theory-002-planimetry"
      ],
      "view": "rectangle",
      "children": [
        {
          "id": "help-2",
          "question": "Что можно взять в качестве искомых отрезков?",
          "text": "Проверь диагонали: они пересекаются, но имеют равные длины.",
          "theoryIds": [
            "atanasyan2024-theory-002-planimetry"
          ],
          "view": "diagonals"
        }
      ]
    }
  ],
  "steps": [
    {
      "id": "step-1",
      "title": "Построим прямоугольник",
      "prompt": "Можно ли расположить его между α и β?",
      "explanation": "Плоскость γ, пересекающая параллельные α и β, пересекает их по параллельным прямым. В γ на этих двух прямых можно построить противоположные стороны AB и CD прямоугольника ABCD. Тогда A,B∈α и C,D∈β.",
      "justifications": [
        {
          "kind": "theorem",
          "text": "Если две параллельные плоскости пересечены третьей, то линии их пересечения параллельны.",
          "theoryId": "theory-011",
          "source": {
            "bookId": "atanasyan-2024-10-11",
            "collection": "theory",
            "point": "11",
            "chapter": "I. Параллельность прямых и плоскостей",
            "printedPages": [
              22
            ],
            "pdfPages": [
              24
            ]
          }
        },
        {
          "kind": "theorem",
          "text": "Между двумя параллельными прямыми в одной плоскости можно построить прямоугольник.",
          "theoryId": "atanasyan2024-theory-002-planimetry",
          "source": {
            "bookId": "atanasyan-2024-10-11",
            "collection": "theory",
            "printedPages": [
              6
            ],
            "pdfPages": [
              8
            ],
            "chapter": "Введение",
            "point": "2",
            "subpart": "planimetry"
          }
        }
      ],
      "view": "rectangle"
    },
    {
      "id": "step-2",
      "title": "Сравним диагонали",
      "prompt": "Удовлетворяют ли AC и BD обоим требованиям?",
      "explanation": "Диагонали прямоугольника равны: AC=BD. Каждая соединяет точку α с точкой β. Они пересекаются в центре прямоугольника, поэтому не параллельны. Такой пример существует; ответ «да».",
      "justifications": [
        {
          "kind": "theorem",
          "text": "Диагонали прямоугольника равны и пересекаются, делясь точкой пересечения пополам.",
          "theoryId": "atanasyan2024-theory-002-planimetry",
          "source": {
            "bookId": "atanasyan-2024-10-11",
            "collection": "theory",
            "printedPages": [
              6
            ],
            "pdfPages": [
              8
            ],
            "chapter": "Введение",
            "point": "2",
            "subpart": "planimetry"
          }
        },
        {
          "kind": "definition",
          "text": "Параллельные прямые не пересекаются.",
          "theoryId": "theory-004",
          "source": {
            "bookId": "atanasyan-2024-10-11",
            "collection": "theory",
            "printedPages": [
              9,
              10
            ],
            "pdfPages": [
              11,
              12
            ],
            "chapter": "I. Параллельность прямых и плоскостей",
            "point": "4"
          }
        }
      ],
      "view": "diagonals"
    }
  ],
  "answer": {
    "mode": "manual",
    "prompt": "Выясни, возможны ли равные непараллельные отрезки между параллельными плоскостями. Обоснуй ответ."
  },
  "review": {
    "source": "passed",
    "mathematics": "passed",
    "pedagogy": "passed",
    "reviewer": "Codex ege_base_inventory; geometry_scene_math_review",
    "at": "2026-10-21T21:16:30Z"
  }
}
