{
  "schemaVersion": 1,
  "revision": 1,
  "id": "research-skew-lines-004",
  "kind": "exercise",
  "title": "Скрещивающиеся прямые · 4. Призма по трём скрещивающимся прямым",
  "status": "reviewed",
  "source": {
    "bookId": "merzlyak-2022-10-base",
    "collection": "research",
    "exercise": "skew-lines-4",
    "printedPages": [
      142
    ],
    "pdfPages": [
      143
    ],
    "chapter": "Дополнительные задачи"
  },
  "statement": {
    "text": "Даны три попарно скрещивающиеся прямые, не параллельные одной плоскости. Докажите, что существует четырёхугольная призма, три ребра которой лежат на данных прямых.",
    "goal": "Построить такую призму."
  },
  "visualization": {
    "type": "scene3d",
    "caption": "Точная иллюстративная конфигурация. Размеры выбраны для наглядности; выводы обосновываются в шагах. Вспомогательные прямые при необходимости продолжаются.",
    "model": {
      "points": {
        "A": [
          0,
          0,
          0.0
        ],
        "B": [
          2,
          0,
          0.0
        ],
        "C": [
          2,
          1,
          0.0
        ],
        "D": [
          0,
          1,
          0.0
        ],
        "A1": [
          0,
          0,
          1.5
        ],
        "B1": [
          2,
          0,
          1.5
        ],
        "C1": [
          2,
          1,
          1.5
        ],
        "D1": [
          0,
          1,
          1.5
        ]
      },
      "edges": [
        [
          "A",
          "B"
        ],
        [
          "B",
          "C"
        ],
        [
          "C",
          "D"
        ],
        [
          "D",
          "A"
        ],
        [
          "A1",
          "B1"
        ],
        [
          "B1",
          "C1"
        ],
        [
          "C1",
          "D1"
        ],
        [
          "D1",
          "A1"
        ],
        [
          "A",
          "A1"
        ],
        [
          "B",
          "B1"
        ],
        [
          "C",
          "C1"
        ],
        [
          "D",
          "D1"
        ]
      ],
      "faces": [
        [
          "A",
          "B",
          "C",
          "D"
        ],
        [
          "A1",
          "B1",
          "C1",
          "D1"
        ],
        [
          "A",
          "B",
          "B1",
          "A1"
        ],
        [
          "B",
          "C",
          "C1",
          "B1"
        ],
        [
          "C",
          "D",
          "D1",
          "C1"
        ],
        [
          "D",
          "A",
          "A1",
          "D1"
        ]
      ],
      "views": {
        "neutral": {
          "label": "Исходная конфигурация. Найдите данные точки и грани.",
          "points": [
            "A",
            "B",
            "C",
            "D",
            "A1",
            "B1",
            "C1",
            "D1"
          ]
        },
        "given": {
          "label": "Данные прямые: AB, A₁D₁, CC₁",
          "segments": [
            [
              "A",
              "B"
            ],
            [
              "A1",
              "D1"
            ],
            [
              "C",
              "C1"
            ]
          ]
        },
        "bases": {
          "label": "Две параллельные плоскости оснований",
          "segments": [
            [
              "A1",
              "D1"
            ],
            [
              "C",
              "C1"
            ]
          ],
          "polygon": [
            "A",
            "B",
            "C",
            "D"
          ]
        },
        "projection": {
          "label": "Проекция b на α вдоль c — прямая AD",
          "segments": [
            [
              "A1",
              "D1"
            ],
            [
              "A",
              "D"
            ],
            [
              "A",
              "A1"
            ],
            [
              "D",
              "D1"
            ]
          ]
        },
        "base": {
          "label": "Параллелограмм ABCD",
          "polygon": [
            "A",
            "B",
            "C",
            "D"
          ]
        },
        "result": {
          "label": "Три требуемых ребра",
          "segments": [
            [
              "A",
              "B"
            ],
            [
              "A1",
              "D1"
            ],
            [
              "C",
              "C1"
            ]
          ]
        }
      },
      "planar": false,
      "labelNames": []
    }
  },
  "help": [
    {
      "id": "help-1",
      "question": "С чего начать?",
      "text": "Достаточно построить параллелепипед. Возьмите первые два направления для плоскостей оснований, третье — для боковых рёбер."
    }
  ],
  "steps": [
    {
      "title": "Плоскости оснований",
      "prompt": "Обозначьте прямые a,b,c.",
      "explanation": "Проведите α через a параллельно b и α′ через b параллельно α. Плоскости различны, иначе a,b были бы компланарны. Поскольку направление c не параллельно α, обозначим C=c∩α, C₁=c∩α′.",
      "justifications": [
        {
          "kind": "theorem",
          "text": "Условие о трёх направлениях исключает параллельность c плоскости α."
        }
      ],
      "view": "bases",
      "id": "step-1"
    },
    {
      "title": "Спроецируем b",
      "prompt": "Рассмотрите плоскость через b, параллельную c.",
      "explanation": "Её пересечение с α обозначим b′. Прямая b′ параллельна b и является её проекцией на α вдоль c. Пусть A=a∩b′. Прямая b′ не параллельна a.",
      "justifications": [
        {
          "kind": "theorem",
          "text": "Параллельные плоскости пересекаются третьей по параллельным прямым."
        }
      ],
      "view": "projection",
      "id": "step-2"
    },
    {
      "title": "Первое основание",
      "prompt": "Постройте через C две параллельные прямые.",
      "explanation": "Через C проведите прямую, параллельную b′, до пересечения с a в B; и прямую, параллельную a, до пересечения с b′ в D. Получен параллелограмм ABCD. Он невырожден: C не лежит ни на a, ни на b′, иначе две исходные прямые пересекались бы.",
      "justifications": [
        {
          "kind": "theorem",
          "text": "Через точку можно провести единственные прямые двух заданных непараллельных направлений."
        }
      ],
      "view": "base",
      "id": "step-3"
    },
    {
      "title": "Призма",
      "prompt": "Перенесите основание на вектор CC₁.",
      "explanation": "Получим параллелепипед ABCDA₁B₁C₁D₁, то есть четырёхугольную призму. Ребро AB лежит на a; A₁D₁ — на b; CC₁ — на c. Значит, требуемая призма существует.",
      "justifications": [
        {
          "kind": "theorem",
          "text": "Параллельный перенос параллелограмма образует параллелепипед."
        }
      ],
      "view": "result",
      "id": "step-4"
    }
  ],
  "answer": {
    "mode": "manual",
    "prompt": "Запишите построение или доказательство. Сверьте рассуждение с шагами; доказательство автоматически не оценивается."
  },
  "review": {
    "source": "passed",
    "mathematics": "passed",
    "pedagogy": "passed",
    "reviewer": "/root/theory_course",
    "at": "2026-10-22T23:06:23Z"
  }
}
